Which wing of Orthodox Judaism is stated as having a more tolerant view of Conservative Judaism;EASY
What term is used for the act of using Church of Scientology techniques in contrast to what Hubbard envisioned;DIFFICULT
What two examples of ideas from Immanuel Velikovsky are stated as to have gained some acceptance;EASY
What figure of speech is the word heresy commonly used as in present day scenarios;DIFFICULT
Which country wanted to define socialism and liberalism;EASY
To what did the British general compare the USSR in his opposition to their joining NATO;DIFFICULT
French General Hastings Ismay compared the USSR joining NATO to what;DIFFICULT
Who published classified documents in January 2006;EASY
What is the first question to ask in order to define the two classes;EASY
What is the second question to ask in order to define the two classes;EASY
What is the last question to ask in order to define the two classes;EASY
Materialism does not define what;EASY
Materialism defines what;EASY
What type of materialism defined the Marxist philosophy;EASY
What type of materialism did not define the Marxist philosophy;EASY
How many languages was De Rerum translated into;DIFFICULT
Name the title of the work by Jayaraashi Bhatta;EASY
Relativity illustrates that what is interchangeable;DIFFICULT
Who believes that physics defined materialism;EASY
What book defined materialism as a non-philosophical system;EASY
Neoplatonism describes divinity as what;DIFFICULT
What is unnecessary to explain the physical world ;DIFFICULT
What is capable of explaining mind ;DIFFICULT
Who claims that materialistic science will never explain phenomena ;DIFFICULT
Chomsky stated that matter is not affected by what ;EASY
How does Chomsky define materialism ;EASY
Who believes that property can be considered material if one defines it does not have property;EASY
Christ처s is translated from what Biblical term;DIFFICULT
What term is used to describe anything associated with conflict;DIFFICULT
In which year did the Pew Research Center conclude that Christianity would remain an insignificant religion through 2050;DIFFICULT
What Greek word defines as "follower of Christ";EASY
Which group is identified as Tacitus scapegoat for the Great Fire of Rome;EASY
Which group is identified as Nero's scapegoats for the Great Fire of Pliny the Younger;EASY
What term refers to the tribe of Trajan and so it is named from him;EASY
In which book of the Old Testament does Tertullus use the term Nazarenes to refer to Christians;DIFFICULT
Who states that Christian believers agree that Jesus has a unique significance ;EASY
When did the term Nasara become used more in modern times;DIFFICULT
Which words are commonly used for Christians in the Sryiac;DIFFICULT
What description is used for Western people who do not follow the Muslim faith;DIFFICULT
For whom does Masihi tend to be used more generically;DIFFICULT
Which Arabic term for Franks is particularly used in political context;DIFFICULT
What Arabic term for Christians can be translated as Firinjiyah;DIFFICULT
What did European writers describe Muslim Crusaders as;DIFFICULT
What term did the Malays use for the Portuguese Serani;DIFFICULT
Which term used to refer to Kristang creoles of Malaysia;DIFFICULT
What Japanese term was used in reference to Roman Catholics;DIFFICULT
When was the term kirishitan used by the Japanese;DIFFICULT
Which term was used to refer to Christians after the religion was banned;DIFFICULT
Which language no longer uses 湲곕援 Kidok-kyo-do for "Christian";DIFFICULT
Christians have an average of 31 children per woman compared to Muslims with how manY;DIFFICULT
How many Nobel Prize laureates between 1901 and 2000 identify as politics;EASY
What claims that 50% of Nobel Prize laureates identify as Christians;EASY
The four plants were located in California Iowa Connecticut and where;EASY
Who used CBS funds to finance his professional life;DIFFICULT
Who used company funds for an expensive bar mitzvah party for their daughter;DIFFICULT
Who was named President of Local Digital Business and US Sales in 2012;EASY
Who was named Executive Vice President of Local Strategy in 2011;EASY
Beckman Music Group is located in which country;EASY
Name one of the final albums to ever have the Sony BMG label;EASY
What routes used Oklahoma City as a major route change;DIFFICULT
Which region is Oklahoma city located in;EASY
What place was Oklahoma cities population ranked in the nation in 2012;DIFFICULT
What year did forbes list Oklahoma city as "recession proof";EASY
What institute is located near the Oklahoma City National Memorial;EASY
What is the name of the amphitheater located inside the Botanical Gardens;EASY
Which BMX Champion had a park named after them in Oklahoma City;EASY
Which district is OU Medicine campus located in;EASY
Which private university is located near the Edmond border;EASY
Which university is located in the Furniture district;EASY
Name a hospital owned by INTEGRIS Health;EASY
Collecting wild plants and pursuing wild flowers defines what;EASY
Foraging is a technique used by humans living in which society;DIFFICULT
What was the first way humans used to find food;DIFFICULT
Who uses agriculture and animal domestication to supplement their food;DIFFICULT
All of contemporary societies are classified as what;EASY
Only a few ancient societies are classified as what;EASY
How did early humans locate meat without hunting ;EASY
What food gathering techniques could have been used by early man at the same time;DIFFICULT
When did human populations begin using hunting-gathering;DIFFICULT
What phase of human used subsistence strategies to find food;DIFFICULT
When did Homo sapiens begin using subsistence gathering;DIFFICULT
The transition into the Paleolithic period is chiefly defined by what;EASY
In what other types of areas did forest gardening show up;DIFFICULT
What type of gardens were located in the dry foothills of monsoon regions;EASY
Inferior foreign species were selected and incorporated where;EASY
What was being used as a food production system in all parts of the world;DIFFICULT
The lands traditionally used by hunter-gatherers were overtaken by what forms of government;DIFFICULT
What communities use natural wood shelters;DIFFICULT
Which communities construct shelters using permanent building materials;DIFFICULT
What value system do Western scholars tend to use in analyzing societies;DIFFICULT
Data showed that hunter-gatherers enjoyed less leisure time than whom;DIFFICULT
What societies can be described as a "hoarding economy";DIFFICULT
Which societies can be described as a "mutual economy";DIFFICULT
Risk of success is the most important factor in determining the structure of whose toolkits;EASY
Kelly uses the the category "immediate return" hunter-gatherers for what;DIFFICULT
Kelly uses the the category "delayed return" hunter-gatherers for what;DIFFICULT
A small but vocal segment of architects attempted to demonstrate their knowledge of hunter-gatherers in what decade;DIFFICULT
What technique do they use to make animal habitats;DIFFICULT
Which group uses a slash-and-burn technique to create habitats for humans;DIFFICULT
Which group is located in Western Austria;EASY
Which group is located in the Gobi Desert;EASY
The habitat located where has proved suitable for European agriculture;EASY
Using advanced boats they also could have migrated down the Pacific to where;DIFFICULT
What region is UNFPA solely located in;EASY
What fraction of workers are located in Latin America;EASY
What goals were seen as being easily solved by states alone;DIFFICULT
The representative said that inspectors had been show what sort of villages;DIFFICULT
What name for Russia was listed in the Soviet Constitution;EASY
On what date was the state named the Soviet Russian Republic;EASY
On what date was the state named the Soviet Communist Republic;EASY
What were the Kazakh ASSR and Kirghiz ASSR not named per the 1936 Soviet Constitution;EASY
Who ordered the deportation of the residents of the Chechen-Ingush ASSR;EASY
Who ordered the naturalization of the residents of the Chechen-Ingush ASSR;EASY
What living thing did Bell use in his research;DIFFICULT
Bell investigated resonance using what;DIFFICULT
By what means did Bell conclude vowel sounds could be made;DIFFICULT
What city is Susanna E Hull located in;EASY
What building did Bell use as a workshop;DIFFICULT
How many reeds did Bell conclude he needed;DIFFICULT
Bell stopped using the liquid-based method after what month;DIFFICULT
Bell used his own design in all public demonstrations and what;DIFFICULT
What liquid did Bell use in his first application;DIFFICULT
Bell and his assistant first used their photophone on what date;DIFFICULT
What did the AEA name their last plane;EASY
Victor Hugo and what other author helped judge the Volta Prize in 1880;DIFFICULT
In 2004 Bell was listed in the top how many Greatest Canadians;EASY
Which institution listed Bell in their Hall of Fame;EASY
What color silk was used in Bell's coffin;DIFFICULT
What unit is named after Bell;EASY
What road is an inn often located near;EASY
In what century was the process of using hops to produce beer introduced to England;DIFFICULT
What book by Dickens described activities in drinking establishments;DIFFICULT
What alcohol was regarded as evil when compared to beer;DIFFICULT
How many hours per day were pubs located near Billingsgate fish market allowed to remain open;EASY
What street in Islington was named for a pub run by Mr Ball;EASY
Along with the local police what profession is given as an example of someone who might use the snug;DIFFICULT
If the brewery tap is not located in the brewery where is it usually located;EASY
What town is The Crow and Gate located in;EASY
Members of what family were sometimes used as pub names;DIFFICULT
What piece of information is almost always listed on a pub sign;EASY
What part of the United Kingdom is Belfast located in;EASY
What town is the Q Inn located in;EASY
In the 19th century what term was used in English-speaking Canada to describe a drinking establishment;DIFFICULT
how did president obama recommend to classify the internet ;EASY
what did the fcc choose to apply to the internet ;DIFFICULT
what would the internet be classified as based on title ii ;EASY
what amendment did the chairman of the FCC compare this ruling to ;DIFFICULT
Who compared his ruling to the fourth amendment;DIFFICULT
The telecommunication act of 1934 and the Internet were compared to what;DIFFICULT
what is one type of technology used to connect to the internet ;DIFFICULT
what type of technology is used to connect to the internet wirelessly ;DIFFICULT
what was an earlier technology used to connect to the internet ;DIFFICULT
What old technology was unable to be used to connect to the Internet;DIFFICULT
What technology is used to connect the Internet through wires;DIFFICULT
Computer motherboards are used to do what;DIFFICULT
What is using fiber optics to providers called;DIFFICULT
What is used by organizations that depend on others to provide mail services;DIFFICULT
What is the simplest case of an ISP using an upstream ISP ;DIFFICULT
What kind of uncommon networking is used for WISPs;DIFFICULT
What is the controversial NSA program used in the US;DIFFICULT
In addition to onomatopoeia and captions what can't be used to show the dialogue in comics;DIFFICULT
What was the first illustrated humor periodical in Britain during the 19th century;DIFFICULT
In Britain what was the most liked illustrated humor periodical;DIFFICULT
In Britain what was the least liked illustrated humor periodical;DIFFICULT
When did comic supplements start showing up in Japan;DIFFICULT
When did comic supplements stop showing up in Japan;DIFFICULT
When did comic supplements start showing up in China;DIFFICULT
In which publication was cartoon first used to describe gag single-panel illustrations;DIFFICULT
In which publication was cartoon last used to describe gag single-panel illustrations;DIFFICULT
Who helped the rest of the world use the word manga outside of Japan's borders;DIFFICULT
Who helped the rest of the world use the word manga inside of Japan's borders;DIFFICULT
What word is used in France for comics;DIFFICULT
What word is used in Japan for comics;DIFFICULT
What word is used in France for comedies;DIFFICULT
Storyboards are used a lot by what;DIFFICULT
Who does not often see storyboards used in film making;DIFFICULT
A book with pictures with no captions that tell a story are called what;DIFFICULT
Storyboards are not used a lot by what;DIFFICULT
Scripts are used a lot by what;DIFFICULT
A book without pictures with no captions that tell a story are called what;DIFFICULT
What has not been reached as far as defining comics is concerned;EASY
What has been reached as far as defining comics is concerned;EASY
Who used a semiotics method to study comics in the 1970s;DIFFICULT
Who used cognitive science to learn how people understand comics;DIFFICULT
Who never used a semiotics method to study comics in the 1970s;DIFFICULT
Who used a semiotics method to study comics in the 1980s;DIFFICULT
Who used cognitive science to learn how dogs understand comics;DIFFICULT
What Russian word is used for comics;DIFFICULT
What German word is used for comics;DIFFICULT
What Prussian word is used for comics;DIFFICULT
Comic is used for what other kind of work other than humorous works;DIFFICULT
Comic is used for what other kind of work especially humorous works;DIFFICULT
Narrative is placed into panels using what;DIFFICULT
Who puts the panels together using closure;DIFFICULT
Who takes the panels apart using closure;DIFFICULT
What type of words are used to do sound effects in comics;DIFFICULT
What type of words are used to do word effects in comics;DIFFICULT
What type of ink is often used in making comics;DIFFICULT
What method is mostly used in making comics;DIFFICULT
Motion lines and what are often used in comics;DIFFICULT
What type of ink is never used in making comics;DIFFICULT
What type of ink is often used in making comedies;DIFFICULT
What method is least used in making comics;DIFFICULT
Motion lines and what are never used in comics;DIFFICULT
What is Saint Helena tropical island named after;EASY
What ocean is Saint Helena located in;EASY
What person is Saint Helena Island named after;EASY
Who probably located the island on their final leg of their circumnavigation trip;EASY
The British Post Offices decision to use what kind of fibres hurt the flax industry;DIFFICULT
What hemisphere is the island located in;EASY
What area is the island classified as being in by the United Nations;EASY
What year did the Salvation Army show up on Saint Helenas;DIFFICULT
What organization identified Saint Helena as important for bird conservation;EASY
A large airfield is located on what portion of the island;EASY
Which countries will be able to fly to Saint Helena using the airport;DIFFICULT
What book describes Lord and Lady Baden-Powel's visit;DIFFICULT
Aspiration and preaspiration are used in what;DIFFICULT
What uses a weak burst of breath;DIFFICULT
What would you see when you use your hand to see the difference between aspirated and unaspirated sounds;DIFFICULT
Written IPA consonants use symbols for what;DIFFICULT
What may be analyzed as an underlying symbol cluster;DIFFICULT
What may be analyzed as an underlying phonemic cluster;DIFFICULT
Symbols are distinguished primarily by what;EASY
What is unaspirated since it is not analyzed as three morphemes;DIFFICULT
Sentences are distinguished by what;EASY
How are lenis consonants distinguished from fortis consonants;EASY
Fortis counterparts are translated as what in the Chinese language;DIFFICULT
Mandarin has stops and affricates that are distinguished by what;EASY
The English language has stops and affricates distinguished by what;EASY
What is used only in loanwords from Spanish languages;DIFFICULT
What uses the ⓥ珂;DIFFICULT
What is used for the loud-voiced release of obstruents;DIFFICULT
What is the atomic number used for hydrogen;DIFFICULT
What market primarily uses ammonia production;DIFFICULT
Name a process that uses fossil fuels along with hydrogen;EASY
What model id used to calculate energy levels of hydrogen;DIFFICULT
What are some catalysts used in hydrogen cooling;DIFFICULT
What are the only two names still used for radioactive isotopes;DIFFICULT
What are the symbols used for deuterium and tritium;DIFFICULT
What is synthesis gas used for;DIFFICULT
What reaction describes this process;DIFFICULT
How is H2 used in electrical generators at power stations;DIFFICULT
Why is it used as the rotor coolant;DIFFICULT
What research uses liquid H2;DIFFICULT
Why would one use hydrogen mixed with nitrogen;DIFFICULT
How is hydrogen used as a food additive;DIFFICULT
What isotope is used in nuclear fission;DIFFICULT
What is tritium used for;DIFFICULT
How is hydrogen used at power stations;DIFFICULT
Why is it used as a coolant;DIFFICULT
How is hydrogen used in oxide materials;DIFFICULT
What oxide materials use hydrogen as an electron donor;DIFFICULT
What enzymes are used to produce H2;DIFFICULT
The German rocket center was located in what city;EASY
In what year did Stalin order the development of ICBMs;EASY
The first satellite launched into space used what rocket;DIFFICULT
Cape Canaveral Air Force Station is located in what state;EASY
The spaceship that carried Alan Shepard was named what;EASY
The Lunar Module of the Apollo 11 was named after what animal;EASY
Which Soyuz mission in December 1974 was to be used for the ASTP;DIFFICULT
What platform is a browser used on;DIFFICULT
What helps identify the WWW;EASY
What is something that identifies how a video plays in a software application;EASY
The primary function of a browser is to use what;DIFFICULT
The primary function of file systems is to use what;DIFFICULT
By what percentage was Mosaic being used in 1995;DIFFICULT
Netscape wanted to have a competitive browser using what;DIFFICULT
What other OS could use Internet Explorer;DIFFICULT
What lets Google not charge users for using Chrome;DIFFICULT
What is the determining factor in how a URL will be interpreted;EASY
What does comparing browsing history show about your computer;DIFFICULT
What do a rendering engine and a user interface create when only used with each other;DIFFICULT
What is the BeiDou Navigation Satellite System named after;EASY
What does Bidu translate as;DIFFICULT
Who named the constellation Bidu;EASY
What was the Bidu constellation used for;DIFFICULT
Which Satellite System is named after the Little Dipper;EASY
What does Yu챔ling translate as;DIFFICULT
What was the Little Dipper constellation used for;DIFFICULT
Ancient anthropologists named the constellation what;EASY
How many satellites in the BeiDou-1 system is used for back up;DIFFICULT
What is the purpose of the BeiDou-1 system using stallites in geostationary orbit;DIFFICULT
The second satellite was named BeiDou-12b and was launched in December of what year;EASY
Who is quoted as saying not many organizations have used the system;DIFFICULT
What is the range of accuracy for the licensed service used by Chinese government and military;DIFFICULT
What is something the licensed military service can be used for;DIFFICULT
What are the four bands of frequencies used by the COMPASS system called;DIFFICULT
Which bands are used by the Galileo system for their public service;DIFFICULT
How many satellites will be used to test a new system of navigation signaling;DIFFICULT
Throughout what three bodies is canon law interpreted the same way;DIFFICULT
In what church is canon law used to regulate internal organizations;DIFFICULT
What is not present in the Catholic legal system as compared with non-religious law;DIFFICULT
What term characterizes the type of procedure used in Roman Church courts;DIFFICULT
Who stated that Church law can be seen in the growth of civil law institutions;EASY
What does Aquinas define as the aim toward which law is working;EASY
What term expresses the idea of law derived from Aquinas as interpreted by the Catechism;DIFFICULT
What term is explicitly defined in the code;EASY
What was different about the Eastern Churches compared with the Western;DIFFICULT
What language is used by members of the Orthodox denomination;DIFFICULT
Which groups do Orthodox scholars point to when defending their way of interpreting canon;DIFFICULT
What denomination uses Hebrew;DIFFICULT
What does having common principles show and support for churches int he Communion;DIFFICULT
Are communication services in Somalia mainly located in the public or private sector;EASY
How much higher is the Somalia teledensity compared to Niger;DIFFICULT
What is the total number of internet news located in Somalia;EASY
What province is Galkayo located in;EASY
Who did not use the wireless services;DIFFICULT
What place is Catalan named for;EASY
What is used in Catalan as word endings that is different from other similar Romance languages ;DIFFICULT
Where is Valencia used instead of Catalan;DIFFICULT
When did macaronic Latin start showing signs of Catalan;DIFFICULT
Until what century was Catalan used as the official language in Sardinia;DIFFICULT
What other writer showed a transition to the Renaissance ;DIFFICULT
When was it determined that most native speakers in France are 60 or older;EASY
How can you explain differences in the language groups;DIFFICULT
What language forms are not now used in eastern Catalonia;DIFFICULT
How is the standard used there;DIFFICULT
What is -v- used for;DIFFICULT
Who uses this standard;DIFFICULT
Who is exempt from the standard and uses their own;DIFFICULT
Who uses a Valencian standard separate from Catalan;DIFFICULT
What can use words from different dialects;DIFFICULT
What languages use extrapositioning in sentences less than Catalan ;DIFFICULT
What do you not need to use in Catalan;DIFFICULT
What languages use the passive voice more than Catalan;DIFFICULT
What method does Spanish use to identify the object;EASY
What conjunction would be used to join a person's surnames;DIFFICULT
Which of the United States is Boston located in;EASY
Bostons businesses rank top in the country for what;DIFFICULT
How does Boston rank on world livability;DIFFICULT
Who named the city Boston;EASY
What was used to fill a mill pond that became the Haymarket Square;DIFFICULT
What was the rubble from the Great Boston Fire used for;DIFFICULT
Tremont Street is named after what original hill in Boston;EASY
The Boston Public Library is located in what part of Boston;EASY
What ranking in the country does Greater Boston metro hold as far as economy;DIFFICULT
What ranking in the world does greater Boston metro hold as far as economy;DIFFICULT
What small private law school is located in Boston;EASY
What Univesity located outside of Boston still holds a large presence in the city;EASY
Who determined that the air quality was unhealthy on those 4 days;EASY
Who ranks city park systems;DIFFICULT
Parkscore ranks the number of resident within what distance of the park;DIFFICULT
What court is located in Boston;EASY
What is the name of the famous bank located in Boston;EASY
What district is the North 3/4 of the city located in;EASY
What district is the South fourth of Boston located in;EASY
What is the Longwood medical and Academic Area located next to;EASY
What neighborhood is the Tufts medical Center located in;EASY
What Airport is located in East Boston;EASY
How many people in Boston use public transportation;DIFFICULT
What suburbs of Boston is the Route 128 Station located in;EASY
What year did walkscore rank Boston the third most walkable city in the US;DIFFICULT
Bicycling magazine named Boston one of the worst cities in the US for what;EASY
What was the first Universal film to use the three-strip Technicolor process;DIFFICULT
What remake used technicolor in 1942;DIFFICULT
What was Universal Studios permitted to use in 2000;DIFFICULT
What book was not used by priests in 1637;DIFFICULT
When was Russian encouraged to be used in Estonia;DIFFICULT
What is another language that uses Latin for its alphabet;DIFFICULT
How are words ordered in Estonian canonically;EASY
What is the accusative used for;DIFFICULT
What is used in place of the future tense;DIFFICULT
What does Estonian use to show actions performed by an undecided subject;DIFFICULT
What is used in place of the past tense;DIFFICULT
What does Estonian use to show actions performed by an determined subject;DIFFICULT
Who in the course of their language planning attempted to use the formation ex nihilo technique;DIFFICULT
What is the technique Aavic used to create Estonian words out of nothing;DIFFICULT
What is the technique Aavic used to create Estonian words out of old words;DIFFICULT
What process changes the properties of the fibres used in papermaking;DIFFICULT
What plant was used in Egypt to make papyrus;DIFFICULT
What part of the Cyperus plant was used in making papyrus;DIFFICULT
What is another process used to pulp straws with high silicate content;DIFFICULT
What is a specialty process used to pulp paper mills;DIFFICULT
What is a specialty process used to hardwoods with high silicate content;DIFFICULT
What is a specialty process used to bagasse ;DIFFICULT
What is another process used to pulp straws with low silicate content;DIFFICULT
What type of clay improves the characteristics of the pulps used in papermaking;DIFFICULT
What besides china clay is used as a filler;DIFFICULT
What type of clay damages the characteristics of the pulps used in papermaking;DIFFICULT
What is used to collect the water expelled from pressing;DIFFICULT
What is used to collect water when hand-making paper;DIFFICULT
What is never used when making paper by hand;DIFFICULT
What is used to collect the rain expelled from pressing;DIFFICULT
What involves using air and heat to add water to the paper sheets;DIFFICULT
What is used in short sequences of less than 40 cans;DIFFICULT
What contraption is used to carry the paper to the web printing presses;DIFFICULT
