When a switch is used in an electrical circuit the switch can;DIFFICULT
Rocks are classified as igneous metamorphic or sedimentary according to;EASY
Scientists use the term "light year" to describe;DIFFICULT
Which group of organisms can show significant trait changes in the shortest period of time;DIFFICULT
Which best describes why winds at the beach change direction between day and night;DIFFICULT
Which of the following properties provides the BEST way to identify a mineral;EASY
Which best describes all unicellular organisms;DIFFICULT
Which best describes transportation technology;DIFFICULT
The chemical equation below shows a reaction of copper;DIFFICULT
A calculation based on the chemical energy of gasoline shows that a car should be able to go 100 miles on a gallon of fuel When the car was driven on a test track the car only went 25 miles on a gallon of fuel What accounts for most of the difference;DIFFICULT
Which of the following sentences best explains what happens when puddles evaporate;DIFFICULT
Which lists the diameter of the planets in order from smallest to largest;EASY
A student states that plants grow taller when grown in natural light than they do in artificial light Which method is the best way to determine if the statement is fact or opinion;EASY
Scientists compared Pluto with other objects in the solar system and found that Pluto is smaller than Earth's moon This finding caused scientists to question whether Pluto is a planet because;DIFFICULT
Which statement best identifies a basic need of all animals;EASY
Which of the following describes an instinctive behavior;DIFFICULT
The items listed below were found in a science classroom * a heart made of plastic with many of its parts labeled * clay formed to look like Earth and other planets * a giant plastic plant cell with removable cell parts These items are all examples of;EASY
A student determined the density of different bars of soap Which should the student most likely do to check the accuracy of the results;EASY
Which method below would be the best way to determine if an egg plastic foam a piece of wood or a candle would float on water;EASY
Gold atoms can be identified based on the number of which subatomic particles;EASY
Which best describes the role of the esophagus in digestion;DIFFICULT
Which of these can be described as a system of stars gases dust and other matter that orbits a common center of gravity;DIFFICULT
A scientist uses angstrom units to measure the distance between two points The scientist is most likely measuring the distance between two;DIFFICULT
Which best describes the orbit of the Moon around Earth;DIFFICULT
Which renewable resource is used with photovoltaic cells to produce electricity;DIFFICULT
To safely conduct an experiment using chemicals what should students always do;DIFFICULT
A student conducts an experiment using a common but potentially harmful bacteria culture After working with the bacteria which is the most important safety practice to follow;DIFFICULT
What tool would be used to examine a fingerprint;DIFFICULT
Which sense is used to tell if there is sugar in a glass of tea;DIFFICULT
Which part of the electromagnetic spectrum can humans sense without using equipment or technology;DIFFICULT
The process of digestion breaks down proteins into smaller molecules that are used to rebuild other proteins During digestion proteins undergo;DIFFICULT
Which statement best identifies a living thing that depends on another living thing to survive;EASY
Structural geologists study rock formations to determine the type of environment in which the rocks formed and the events that shaped the rocks Paleontologists study fossils found in rock formations Scientists in both these fields have a common interest in discovering the;EASY
Which of these best defines the term "pollutant";EASY
The cell cycle describes the processes that take place as a cell;DIFFICULT
A company that makes fences started using a new material instead of wood The new material will last longer than wood What is the most likely benefit of the new material;DIFFICULT
Which best explains how the Appalachian Mountains formed;DIFFICULT
A student used two long wires to connect a lightbulb to a battery The student noticed that as soon as the circuit was complete a nearby compass started to point in a direction other than north The compass pointed in a different direction because it was reacting to the;DIFFICULT
If two organisms are classified in different orders but are in the same class which of these statements is true;EASY
Why do mountain climbers at high elevations use oxygen tanks to help them breathe;DIFFICULT
Which metric unit is used to describe an object's length;DIFFICULT
The work of which scientist serves as the basis for many procedures used in agriculture such as selective breeding of plants;DIFFICULT
A person named Leonardo da Vinci studied many things including animals geology clouds and flight His study of birds helped him design the first parachute Everything he saw made him ask how and why Which human quality most likely made this person want to study many different things;EASY
If a scientist wants the medical community to revise old information and use new research findings in the treatment of a disease it would be best to present the information;DIFFICULT
Phobos is one of two large objects that orbit the planet Mars Because Phobos orbits Mars Phobos should be classified as which type of body;EASY
Sir Isaac Newton determined that white light is made up of all the colors of the rainbow What did he use to discover this phenomenon;EASY
Species are classified based on their characteristics Which characteristic identifies two organisms as members of one species The organisms;EASY
Which part of a plant is used to absorb sunlight during photosynthesis;DIFFICULT
Which best describes a proton;DIFFICULT
For two organisms to be classified as the same species they must produce offspring that are;EASY
Which sentence best describes the organization of the heart;DIFFICULT
What would be the best way to determine the role of squirrels in a forest ecosystem;EASY
Which of the following systems breaks food into nutrients that can be used by the body;DIFFICULT
Which of these renewable resources results in an increase in pollution when used to produce energy;DIFFICULT
The BEST way to tell the DIFFERENCE between an oak and a maple tree is to compare the;DIFFICULT
Which example describes a learned behavior in a dog;DIFFICULT
Which of these explains how a trench can form;DIFFICULT
Which statement identifies an energy source as renewable;EASY
Which statement is describing climate;DIFFICULT
Which metalloid is used in solar cells and computer chips;DIFFICULT
Which best describes the function of the small intestine;DIFFICULT
Why are many telescopes used far from cities;DIFFICULT
Which best explains why a person infected with bacteria may have a fever;DIFFICULT
What is determined by the speed that Earth rotates on its axis;EASY
A scientist developed a model that described the actions of DNA in the cell nuclei which helped explain how traits were inherited Which scientist helped develop this model;DIFFICULT
Which tools are best used to determine the speed of a turtle as it walks along a path;DIFFICULT
Why would explorers use a compass when traveling to unknown lands;DIFFICULT
Which measurement tool is used to find the volume of a small piece of granite;DIFFICULT
Which unit of measurement can be used to describe the length of a desk;DIFFICULT
Compared to other stars in our galaxy which is the best description of our Sun;DIFFICULT
Which of the following describes asexual reproduction;DIFFICULT
What determines if twins are identical;EASY
Salt concentration water temperature plankton and the whale shark might all be used in a description of an ocean;DIFFICULT
Rocks can be classified many different ways including as igneous metamorphic and sedimentary This classification is based on the;EASY
A student is growing some plants for an experiment She notices small white spots on the leaves Which tool should she use to get a better look at the spots;DIFFICULT
Hydrogen is located on the left side of the periodic table in the same column as the alkali metals but it has characteristics of a nonmetal Which of the following is a physical property of hydrogen;EASY
A wind turbine primarily uses which type of energy;DIFFICULT
A greenhouse is used as a model of the atmosphere Which of the following cannot be demonstrated by the model;DIFFICULT
What form of energy is being used when a person pushes a wooden block across the floor;DIFFICULT
Which is a nonrenewable natural resource that is used to make electrical energy;DIFFICULT
Which of the following best explains why the tectonic plates of Earth move;DIFFICULT
After a race a newspaper lists the names of the five fastest runners Another method that could be used to identify the five fastest runners is to make a chart that shows the;DIFFICULT
Which scientist is credited with using a telescope in the seventeenth century to discover the moons of Jupiter;DIFFICULT
Which of these describes a property of all matter;DIFFICULT
Which statement best describes the climate of Nevada;DIFFICULT
Which statement best explains how periods on the periodic table are organized;DIFFICULT
Which term identifies a group of cells that work together to perform a similar function;EASY
Which statement correctly describes a relationship between two human body systems;DIFFICULT
Which statement best explains Earth's day and night cycle;DIFFICULT
An element is identified by;EASY
Runoff from farms that use fertilizers is entering a small lake This will most directly affect the lake by causing;DIFFICULT
Students on two different school campuses are comparing the growth rate of grass three weeks after fertilizer has been applied The same fertilizer and the same amount of water are used on both campuses Which additional variable is most important to control when the results of the two investigations are compared;DIFFICULT
Which biological process determines the probability that particular alleles will be found in any given gamete;EASY
What determines how long the Moon takes to complete one cycle of phases;EASY
A student uses a telescope to view stars at night The student notices some of the stars are different colors The color of a star is determined most by its;DIFFICULT
Which material is the best natural resource to use for making water-resistant shoes;DIFFICULT
Which of the following best explains why the Sun appears to move across the sky every day;DIFFICULT
When a student uses the equation mass multiplied by change in temperature multiplied by specific heat what is being calculated q = m \times C \times \Delta T;DIFFICULT
Electricity to play your radio can be made using renewable or nonrenewable resources Which of the following resources are renewable;DIFFICULT
Copper is used in house wiring because it is;DIFFICULT
What is the best way for a student to describe the results of an experiment;DIFFICULT
Which statement explains what will most likely happen to the hydrosphere in an area where air temperatures increase;DIFFICULT
Which of the following statements best explains why stars appear to move across Earth's sky each night;DIFFICULT
Farmers in the 1800s used axes to clear trees from farmland Now farmers use chainsaws to clear the trees How do chainsaws most likely help farmers;DIFFICULT
A researcher determines a cell has a flexible cell wall composed of peptidoglycan This observation narrows possible classifications of the cell to which taxonomic group;EASY
A student conducts an investigation using mold spores In one part of the investigation he needs to closely examine a spore sample Which piece of equipment does the student need to use to keep mold spores from entering his respiratory system;DIFFICULT
Which property of an object can be described as smooth;DIFFICULT
Which term identifies a single unit of hereditary information;EASY
Which example shows a new substance being formed;DIFFICULT
What do all mammals have in common that distinguishes them from birds;EASY
Which of the following best describes a mineral;DIFFICULT
A student is measuring the distance a car travels down a ramp using yards Which measurement is most similar in length when using the metric system of measurement;DIFFICULT
Which scientist formulated rules that describe the observable relationships of plant traits to the traits of the ancestor plants;DIFFICULT
Which tool is used to measure the diameter of a dime;DIFFICULT
Which unit is used to indicate the amount of energy in food;DIFFICULT
Census data show that the human population doubled from 265 billion in 1953 to 53 billion in 1990 If it continues to double at this rate the human population could reach 10 billion by the year 2020 Which best explains how this rate of human growth can harm the environment on which humans depend;DIFFICULT
Bats find their prey at night using one of their senses to detect echoes What does the bat send out to find prey;DIFFICULT
Which example describes an organism taking in nutrients;DIFFICULT
An electrical circuit can be used to break down water into hydrogen and oxygen In this process electrical energy produces;DIFFICULT
Which method could be used to separate a solution of table salt and water;DIFFICULT
Which of the following correctly orders part of a fish's respiratory system from the least complex to most complex;EASY
When sound waves with large amplitude are compared to sound waves with small amplitude which of the following is true;DIFFICULT
Which of the following best describes the climate of an area;DIFFICULT
All natural resources on Earth are either renewable or nonrenewable Whether a resource is renewable or nonrenewable depends on how fast or slow the resource is replaced If the resource is used faster than it is replaced then the resource will in time disappear Which statement describes the use of a renewable natural resource;DIFFICULT
Which of the following statements best explains why earthquakes occur more frequently in California than in Massachusetts;DIFFICULT
Which of these describes a chemical change;DIFFICULT
A homeowner wants to use a renewable resource to heat the home Which resource would be the best to use;DIFFICULT
A student observes cells in an object by using a microscope The student thinks that the object was part of a living thing Which statement explains why cell theory can be used to support the student's thinking;DIFFICULT
Which would be the best method to use to dispose of cardboard boxes not utilized by a local grocery store;DIFFICULT
Which item is used for protection from chemical splashing;DIFFICULT
Which tool should a student use to compare the masses of two small rocks;DIFFICULT
Which statement best describes the nature of sound;DIFFICULT
Which of the following describes a reason why companies irradiate some fruits and vegetables before they are sold to the public;DIFFICULT
In the morning students observed puddles of water all over the playground What would best explain why the playground was dry in the afternoon;DIFFICULT
Which statement best describes the energy transformations that occur when a candle burns;DIFFICULT
Living things are classified as producers or consumers according to;EASY
Which of these can be mined from Earth and used as an energy source;DIFFICULT
Which tool is used to determine how long it takes warm water to melt an ice cube;DIFFICULT
Which of the following groups of organisms uses sunlight to convert carbon dioxide and water into sugar and oxygen;DIFFICULT
Solids that are combined together and maintain their physical properties are best labeled as a;EASY
Which statement explains why light from the Sun can warm up water in a glass;DIFFICULT
Which sense is used to determine an object's texture;DIFFICULT
Which statement describes a method of sexual reproduction that occurs in plants;DIFFICULT
A recent scientific study funded by a medical corporation concluded that its product is not as harmful as consumers have reported Identify a possible problem with this study;DIFFICULT
Sandy and Keith plan to move a 6-kilogram block If they wanted to calculate the mechanical energy required to move the block what units would they use to report their answer;DIFFICULT
Which list is correctly ordered from smallest to largest;EASY
Which best describes a characteristic of the jet stream;DIFFICULT
Which BEST explains why green marine algae are most often restricted to the top 100 meters of the ocean;DIFFICULT
The longitude of a location determines which time zone it is in Different time zones are the result of;EASY
Burning coal and natural gas are ways to produce electricity Both coal and natural gas are nonrenewable resources Which is an example of producing electricity using a renewable source of energy;DIFFICULT
A student uses a hand lens to observe which of these objects;DIFFICULT
When animals use energy they produce;DIFFICULT
Which of the following describes how a microwave oven heats food;DIFFICULT
Which living organism makes its own food using sunlight;DIFFICULT
Down feathers are used by many sleeping bag manufacturers because down feathers are;DIFFICULT
Which model best illustrates the wave property that enables scientists to explore Earth's interior using seismic waves;DIFFICULT
Which statement describes the location of our Sun in the universe;DIFFICULT
Which technology used to generate electrical power involves a trade-off between economical electricity and long-term waste disposal problems;DIFFICULT
Granite is classified as a rock because it;EASY
Carolina uses a microscope to view a soil sample taken from her backyard Which part of the soil would she ONLY be able to see with a microscope;DIFFICULT
Which statement best describes why a calcium-fortified juice would advertise that it is good for growing children;DIFFICULT
Colored alcohol is used in some glass thermometers When placed in air of different temperatures the column of alcohol rises or falls in the glass thermometer Which of the following best explains why the height of the alcohol column changes;DIFFICULT
Which sequence correctly shows the levels of organization for structure and function in a human;DIFFICULT
Which instrument would be used when studying a unit on amphibian anatomy;DIFFICULT
Scientists can identify an element by looking at the structure of a single;EASY
Which of the following is the primary advantage of sexual reproduction when compared to asexual reproduction;DIFFICULT
When a light bulb is turned on energy changes from one form to another Which of the following best describes this change;DIFFICULT
Which two observations are both used to describe weather;DIFFICULT
If the solar system were used as a model of an atom what would the Sun most likely represent;DIFFICULT
Which of these shows the correct order for the central dogma of molecular biology;DIFFICULT
Which best explains why some reptiles and amphibians lay an abundance of eggs;DIFFICULT
Which of the following is one reason that quartz is classified as a mineral;EASY
Which is a feedback mechanism the human body uses to maintain homeostasis;DIFFICULT
A scientist was examining a large boulder that was covered with lichens;DIFFICULT
Paula determines a property of a marble using a balance and a graduated cylinder What property is Paula most likely determining by using both tools;EASY
Certain fossils can be used to help determine the age of the rock layer in which the fossils are found Which type of fossil is best to use when making this determination;DIFFICULT
When compared to current average conditions which term would best describe conditions in Earth's lower atmosphere if greenhouse gases were absent;DIFFICULT
Plumes of water vapor have been observed rising from the southern polar region of Enceladus one of the moons of Saturn A team of scientists proposed an explanation for the plumes and developed a model They also published calculations based on their model These calculations would most likely be used for which purpose in future research;DIFFICULT
Which sense can be used to determine an object's ability to reflect light;DIFFICULT
The North America Nebula is named for its similarity in shape to the North American continent It was discovered within the Milky Way by astronomer William Herschel in 1790 What was Mr Herschel most likely observing;EASY
A recent study concluded that about 90% of all large predatory fish such as tuna have disappeared from the world's oceans in the past 50 years Which of these is most likely the direct cause of this loss;DIFFICULT
Scientists are discovering ways to make some crops use less water A person working in which job would most benefit from this research;DIFFICULT
Sherry is going to use her computer to draw a three-dimensional box She wants to be able to specify the exact dimensions and angles and to rotate the box as needed on the screen Which of the following types of programs would Sherry most likely use for this purpose;DIFFICULT
Scientists who have studied the hydrosphere concluded that about 71% of Earth is covered with water Which part of the hydrosphere is most often associated with the formation of organic rocks;DIFFICULT
What is the best way for a marine scientist to determine the eating habits of sharks;EASY
The human body processes and eliminates food waste using the organs of the excretory system Which organelle performs a similar function in humans at the cellular level;DIFFICULT
The theory of continental drift states that the land masses called continents were once closer together and have drifted apart over time Which circumstance is the strongest evidence in support of this theory;EASY
Rich beds of marine fossils have been found in Florida By dating these fossils scientists can best determine;EASY
Which of these describes a small range in the electromagnetic spectrum;DIFFICULT
Which tool would be best to use for counting the number of legs on an ant;DIFFICULT
Which sequence lists the levels of organization in the human body from simplest to most complex;EASY
Cancer is best described as;DIFFICULT
Several interchangeable parts are used in the manufacture of automobiles Some examples of these parts are batteries windshield wiper blades spark plugs and tires Which of the following is an advantage of interchangeable parts over non-interchangeable parts on automobiles;DIFFICULT
Homes that are built to be environmentally friendly because they use energy more efficiently than other homes are called "green" homes "Green" homes often have reflective roofs and walls made of recycled materials The windows in these energy-saving homes are double-paned meaning each window has two pieces of glass Double-paned windows have a layer of air between the window panes This layer is a barrier against extreme temperatures and saves energy A solar panel on a "green" home uses;DIFFICULT
Water is often put through a treatment system before it is used in homes as drinking water Which is the most likely reason water is treated before people drink it;DIFFICULT
Which tool should be used to compare the growth of an algal colony growing in a petri dish;DIFFICULT
Use The Periodic Table of the Elements and the information below to answer the question Magnesium metal;DIFFICULT
Which scale is used to report the intensity of an earthquake;DIFFICULT
Which distance is the smallest for which it is most practical to use the light-year as a unit of measurement;DIFFICULT
Minerals can be identified using hardness streak and cleavage because;EASY
DNA molecules contain the genetic information that determines the characteristics of a living organism How do DNA molecules express the genetic information they contain;EASY
Which term describes Earth's orbit around the Sun;DIFFICULT
What characteristic of viruses distinguishes them from cells;EASY
Students studying the atmosphere want to display the percentage of each greenhouse gas as compared to the total amount of greenhouse gases found in the atmosphere Which representation would be most appropriate for displaying these percentages;DIFFICULT
Which describes a specific characteristic necessary for survival in the desert;DIFFICULT
An element with which property would be best to use in electrical wiring;DIFFICULT
The Greek philosopher Aristotle described matter with the phrase "unable to be divided" The modern concept that grew from Aristotle's idea is the;DIFFICULT
What statement describes what happens to the carbon dioxide waste produced by a developing baby during pregnancy;DIFFICULT
Which object would best help a student determine if a block of an unknown material is magnetic;EASY
A girl with long hair is going to be participating in an experiment that uses an alcohol burner for an energy source What is the best thing for her to do to prepare for this experiment;DIFFICULT
Which of the following best describes an atom;DIFFICULT
Condensation in the water cycle can best be described as the result of water vapor;DIFFICULT
Which of the following gases do plants use in photosynthesis;DIFFICULT
A scientist plans a project to determine the effect of rain on the formation of caves An area of rock has been chosen as the site for the investigation How often should the scientist measure the changes in the rock;EASY
A small fast-moving river in is in a V-shaped valley on the slope of a mountain If you follow the river to where it passes through a plain what will the river most likely look like compared with how it looked on the mountain;DIFFICULT
A teacher asks her students to examine titles of four scientific articles Which titled article is specifically about a chemical change;DIFFICULT
A scientist looks at a graph that shows the percentages of humus clay and sand that make up a soil If the scientist had the total weight of each material instead of percentages what type of graph would be best to illustrate the data;DIFFICULT
Which unit of measurement describes an object's length;DIFFICULT
