What objects were not used by early farm societies in Africa;DIFFICULT
Who used pottery before developing events;DIFFICULT
What materials were used to build the wall around Jericho;DIFFICULT
What materials were used to build the wall around PPNA;DIFFICULT
What traits did researchers use to divide the ten periods;DIFFICULT
What traits did researchers use to divide the nine periods;DIFFICULT
What technology will researchers use to measure a more accurate time period for the farm site;DIFFICULT
What technology will researchers use to measure a more accurate discovery for the farm site;DIFFICULT
What term is used to describe the mid-late Neolithic era in American education;DIFFICULT
What term is used to describe the Early Neolithic era in American education;DIFFICULT
What term is used to describe the mid-late Neolithic era in Asian education;DIFFICULT
What term is used to describe the Early Neolithic era in Asian education;DIFFICULT
What theory describes the implied egalitarianism of Neolithic societies;DIFFICULT
What theory describes the implied egalitarianism of labor societies;DIFFICULT
What is a theory that has explained the egalitarianism of labor societies;DIFFICULT
Where were entrances located in early homes;EASY
Where were entrances located in early ladders;EASY
What purposes were the production of farm tools used for;DIFFICULT
What types of tools did early farmers use for crops;DIFFICULT
What types of tools did early farmers use for food production;DIFFICULT
What purposes were the production of statuettes used for;DIFFICULT
What types of tools did early farmers use for shelter;DIFFICULT
What did Neolithic people use mud-brick to build;DIFFICULT
What did European people use mud-brick to build;DIFFICULT
What did early humans use to make clothing;DIFFICULT
What evidence suggested that humans used animal products for clothing;DIFFICULT
What were perforated stones used for;DIFFICULT
What did early humans use to make bones;DIFFICULT
What evidence suggested that humans used copperl products for clothing;DIFFICULT
What were perforated antlers used for;DIFFICULT
What did Hayek conclude regarding his brothers;DIFFICULT
Where did first show his work;DIFFICULT
What is the term used to describe economists following Keynes school of thought;DIFFICULT
What did Hayek use to refer to the spread of ignorance and misunderstanding within the social sciences;DIFFICULT
What is the term used to describe the obligation for humans to avoid disrupting the ecosystem;DIFFICULT
Who made the claim that Hayek was particularly determined regarding his beliefs on social insurance and a safety net;EASY
What term does Diamond use to refer to Hayek;DIFFICULT
Diamond states that the final result of Hayek's statements are what;EASY
Whom did the Prime Minister of England choose as secretary of state;DIFFICULT
What word is used in the United States to identify Hayek's ideology;DIFFICULT
What term do those who disagree with Hayek use to describe his ideals;DIFFICULT
Name some examples of non-infectious causes of hyperthyroidism;EASY
Name two examples when amounts of salts and sugar are recommended although rarely used;EASY
What can be used if commercial antibiotics are not available;DIFFICULT
Name other causes of viral infections;EASY
What does evidence show that helminth disease impacts;DIFFICULT
What is the downfall of using immunization against the pathogens that cause disease;DIFFICULT
What has been used and shown successful in a decrease in incidence of diarrheal disease;DIFFICULT
What strategy showed a decrease in the incidence of dietary deficiencies;DIFFICULT
What can be used to prevent dehydration;DIFFICULT
What can WHO be used for in children ;DIFFICULT
Can you name some plain water solutions;EASY
What can be used to give fluids when they can not drink;DIFFICULT
What can be used to give fluids if drinks are too rich in sugar;DIFFICULT
Are antibiotics used in diarrhea instances;DIFFICULT
Are antibiotics used in certain types of antibiotic resistance;DIFFICULT
Who was named as a teacher at the second madrasa housed in a mosque;EASY
Who was named as a teacher at the last madrasa;EASY
How many component of education did Ibn Sina describe in their teachings;DIFFICULT
What do scholars that specialize in the medieval period describe madaris as;DIFFICULT
Who determines the content taught in Arabic public schools;EASY
What curriculum is used in non public madaris in Mindanao;DIFFICULT
What county is Miami located in;EASY
Where does Miami rank among American cities by population;DIFFICULT
Where did Miami rank among cities around the world in regard to finance;DIFFICULT
Where does Miami rank in terms of US Spanish-speaking populations;DIFFICULT
Where does Miami rank in terms of UN Spanish-speaking populations;DIFFICULT
How many meters did the Sangamonian Stage raise sea levels compared to their present level;DIFFICULT
How many kilometers did the Sangamonian Stage raise sea levels compared to their present level;DIFFICULT
What northern Miami neighborhood is named for a Caribbean country;EASY
Where does Miami rank in population among US cities;DIFFICULT
Where does Miami rank in population among UN cities;DIFFICULT
Where does the area around Miami rank internationally in terms of foreclosures;DIFFICULT
How many passengers use Miami International Airport annually;DIFFICULT
What airline uses Miami International as its biggest international gateway;DIFFICULT
How many pilots use Miami International Airport annually;DIFFICULT
What airline uses Miami International as its smallest international gateway;DIFFICULT
How many passengers used PortMiami in 2007;DIFFICULT
How many passengers used PortMiami in 2017;DIFFICULT
How much does it cost to use Metromover;DIFFICULT
Approximately how many people were intended to use Miami Intermodal Center;DIFFICULT
Approximately how many people were unintended to use Miami Intermodal Center;DIFFICULT
Where does it rank in comparison to other US cities in GDP;DIFFICULT
What type of street layout did Penn use for Philadelphia;DIFFICULT
What phrase could describe Philadelphia of the early 20th century;DIFFICULT
Name a type of row house in the city;EASY
Name the six largest European ethnic groups in the city;EASY
Name three sub-cultures in the Center City;EASY
Name a University located in the city;EASY
Name the archaeology museum;EASY
Name a museum named after a founding father;EASY
Name the accent spoken in the area;EASY
Name two districts with good night life;EASY
Who uses the opera house;DIFFICULT
Name a type of music from the 70's that influenced the nation;EASY
Name a hip/hop artist from the city;EASY
Name a smaller newspaper;EASY
Name a Jewish newspaper;EASY
Name the 3 public radio stations;EASY
Name a proposed project to repalce it;EASY
Name the main airport;EASY
Where does PHL rank in the list of busiest airports;DIFFICULT
What airline uses this airport as its primary international hub;DIFFICULT
Name a bridge in the city;EASY
What bus line uses the city as a hub;DIFFICULT
Name 2 rail companies that use the city as a hub;DIFFICULT
What area code is used in Philadelphia in 1947;DIFFICULT
What story described the events of Feb 28 1969;DIFFICULT
What was Kerry's actual career voting rank for 'liberalness';DIFFICULT
When did Kerry choose John Edwards to be his VP;DIFFICULT
How had some State employees described Kerry;DIFFICULT
Where would Kerry have ranked among richest US presidents adjusted for inflation;DIFFICULT
What did Kerry tell Christianity Today that he is open-minded to;DIFFICULT
What bicycles did Kerry use while campaigning;DIFFICULT
What phrase did James Tod use when translating ferishta's history of Islamic India;DIFFICULT
Who was the capital of Gujarat named after;EASY
What type of fibre is Rajasthan ranked 2nd in production of;DIFFICULT
What prominent companies are located in Pali;EASY
At what level is Rajasthan ranked in India for visits by foreigners;DIFFICULT
How high is Rajasthan ranked among domestic Indian tourists;DIFFICULT
Where were the matua located on the island;EASY
What year did Magellan locate the island of Guam;EASY
How deep is the Mariana Trench located near Guam;EASY
What are used as slingstones by the Chamorro traditionally;DIFFICULT
What determines the speed in which mail reaches Guam from the United States;EASY
What do most Guam residents use when receiving mail;DIFFICULT
Which commentator summarized a position in latin;DIFFICULT
What position by Plato was summarized by Middle Ages commentators;DIFFICULT
Who judged everything according to mental ideals;DIFFICULT
What is necessary to explain a doctor's normality in sensory terms;DIFFICULT
How did it become possible for physical object statements to translate into sense-data statements;DIFFICULT
Who named neopositivism;EASY
How did James define reality;EASY
What is the term used for philosophies that consider the spiritual to be of paramount importance;DIFFICULT
Berkeley defines idealism by saying we can never be sure of what;EASY
What sort of idealist did Hegel define himself as;EASY
How did Berkeley label his own idealism;EASY
What did Kierkegaard say could explain all of reality;DIFFICULT
Who did McTaggart say was best prepared to use their philosophy to decide how to vote;DIFFICULT
What languages were only used by Hungarians from 1918-1938;DIFFICULT
How long was the precursor to Czech classified as Old Czech;EASY
How many genders were used in Lithuanian in the past;DIFFICULT
What survey showed German as the foreign language used most often in Poland;DIFFICULT
What were parodies of journalists used for;DIFFICULT
Which of the Czech dialects is the only one distinguished in the nationwide surveys by the Czech Statistical Office;EASY
What language has used borrowed words from Russian;DIFFICULT
What sentence structure is used in Pavla;DIFFICULT
What is word order used for in Pavla;DIFFICULT
What nouns does Czech use the accusative case to mark;DIFFICULT
What two terms distinguish between hypothetical sentences in Czech;EASY
In which verbs in Czech is the action the verb describes still ongoing;DIFFICULT
What describes the state of the action of the verb at the time specified by its tense;DIFFICULT
What character is only used in other European languages;DIFFICULT
What can be used in Latin when writing noun phrases ;DIFFICULT
What can always be used in decimal places in Latin;DIFFICULT
Latin uses a decimal comma instead of what;DIFFICULT
In what country is Kindergarten a term used for primary education;DIFFICULT
What is another term used for Primary education;DIFFICULT
What is not another term used for Primary education;DIFFICULT
What was another name used for Higher Education;DIFFICULT
What is another term used for Special Education Services;DIFFICULT
What is not another term used for Special Education Services;DIFFICULT
Who defines informal learning;EASY
Who does not define informal learning;EASY
What did surveys show in 2008;DIFFICULT
What is also used interchangeably  with Education psychology;DIFFICULT
Who are likely to be identified as educational psychologist;EASY
What are not identified as educational psychologist;EASY
Who focused on identifying stimuli that can influence learning;EASY
 Who discredited identifying stimuli that can influence learning;EASY
Who prefers to label children by learning style;EASY
What defines Philosophy education;EASY
What is another term used for instructors;DIFFICULT
What is the opposite term used for instructors;DIFFICULT
Which museum celebrating popular music is located in Jackson Tennessee;EASY
What tourist attraction is located in Pigeon Forge Tennessee;EASY
Tanasi is know to have been located and mapped by British traders by which year;EASY
Which mountain marked the starting point of the Tennessee border described by the state constitution;DIFFICULT
The principle Bible college of the Free Will Baptists is located in which Tennessee city;EASY
Roughly how many farms are located in Tennesee;EASY
At what rate is Tennessee state sales and use tax usually applied;DIFFICULT
What method did Tennessee use for capital punishment before 1913;DIFFICULT
Who were the first to use the term "post-punk";DIFFICULT
How many chords are never used in punk music;DIFFICULT
How did Nicholas Lezard describe post-punk;DIFFICULT
What does LG Ballard describes post-punk  as;DIFFICULT
Who described post-punk as "a more adventurous and arty form of punk";DIFFICULT
Who described post-punk as  "less a genre of music than a space of possibility";DIFFICULT
Why is only the broadest use of genre possible when trying to categorize what actually defines post-punk;EASY
Who described post-punk as "a less adventutous and arty form of punk";DIFFICULT
What did Simon Reynold describe as multifarious;DIFFICULT
What were many groups now labeled as post-punk initially categorized as;EASY
Who has defined a period of when the post-punk era was;EASY
Between what years did Reynolds identify the post-punk era as existing;EASY
What term was first used in 1978 by writers for Sounds;DIFFICULT
Who used sounds and lyrics similar to their contemporaries in 1977;DIFFICULT
What styles of criticism were not used by writers;DIFFICULT
What did Simon Reynolds describe the era of post-punk as a match for in terms of great music created;DIFFICULT
In America what term is used for both Canadian foobal and Americam football;DIFFICULT
How was it believed that the CFL was used to help struggling Canadian teams;DIFFICULT
What can the team that wins the coin toss choose besides whether they wish to kick off or receive the ball;DIFFICULT
Name a player that commonly receives the first possession of the ball;EASY
What can a team use its 10 yards to gain;DIFFICULT
The outcome of which play determines the placement of the ball when a penalty is declined;EASY
What determines which team gets possession first when extending a game to break a tie;EASY
What two countries concluded a separate peace with Prussia;DIFFICULT
What is the grandest label that historians have used to describe the  Seven Years' War;DIFFICULT
What did Russian Empress Elizabeth use the proceeds of the tax on salt and alcohol for;DIFFICULT
Name two diverse geographies that king George II had to protect;EASY
What country was pleased that Britain used its Hanover vote to elect Joseph as Te Holy Roman Emperor;DIFFICULT
What country and person were displeased that Britain used it Hanover vote to elect Joseph as the Holy Roman Emporer;DIFFICULT
What did Russia use Britain's money for;DIFFICULT
What city is now located where Fort Duquesne was built;EASY
Identify a major factor in this feckless strategy by France of not defending its colonies with enthusiasm;EASY
Identify an advantage that Britain had during the Seven Year's War;EASY
How did the British behave in defending their colonies compared to the French approach;DIFFICULT
How did the timing of the declaration of war compare to the conflicts in North America between Britain and France;DIFFICULT
Describe the command of Prince Ferdinand of Brunswick;DIFFICULT
Describe the command of the Duke ofBrunswich-Bevern;DIFFICULT
Describe the command of Field Marshall James Keith ;DIFFICULT
How did the Russians used the captured Memel;DIFFICULT
Name the four opponents of Prussia;EASY
How would one describe the future participation of Hanover;DIFFICULT
Identify a success of the Austrians;EASY
Identify a new country that joined the war in 1762;EASY
Identify a second new country that joined the war in 1762;EASY
Identify a major Prussian loss to the Russians;EASY
identify a major Prussian loss to the Austrians;EASY
Identify the French colonies lost  to the British in 1759 and 1762;EASY
Identify two other French possessions captured by the British;EASY
Name two major events of the Seven Years' War In North America;EASY
Name two more major events of the Seven Years' War in North America;EASY
Feynman was famous for diagrams that showed how subatomic particles behaved what are these known as;DIFFICULT
Feynman used this to protect his eyes during the test detonation;DIFFICULT
What did Feyman tell the class that they must not do to themselves;DIFFICULT
What did Feynman tell the class that they must do to themselves;DIFFICULT
Which quote by Feynman is often used by string theory opponents;DIFFICULT
Which quote by Feynman is often used by religious opponents;DIFFICULT
His writings about the Rogers Commission showed that trouble was brewing between scientists and executives at which prolific institute;DIFFICULT
Who did NASA recruit by using flawed safety numbers;DIFFICULT
Who did NASA recruit while using accurate safety numbers;DIFFICULT
Who concluded that NASA management was fantastically realistic;DIFFICULT
Which book did Feynman decline to be listed in;EASY
Feynman did not like to be listed in anything that labeled people by what standard;EASY
Which book did Feynman demand to be listed in;EASY
What was the name of the film that showed Feynman's life;DIFFICULT
What was the name of the TV show that showed Feynman's life;DIFFICULT
What analogies did Feynman use to teach Carl;DIFFICULT
What fictional character was Feynman compared to by a colleague;DIFFICULT
What fictional character was Feynman compared to by his son;DIFFICULT
Who helped tell the 1992 New York Times story about Feynman;DIFFICULT
Who helped tell the 1922 New York Times story about Feynman;DIFFICULT
Who failed to describe what has become known as "The Feynman Algorithm";DIFFICULT
How did Gaddafi use all the money that resulted from nationalizing the oil industry;DIFFICULT
Describe the Popular Revolution;DIFFICULT
Name two significant events in 1986 that demonstrated the world's view of Libya;EASY
What geographical portion of Libya is Fezzan located in;EASY
List several biographies that influenced Gaddafi;EASY
What rationale did Gaddafi use for joining the military;DIFFICULT
Name one event that occurred in the Arab world during Gaddafi 's childhood that influenced his life;EASY
What did the Libyan workers do to show their support of Egypt;DIFFICULT
List the two names of Gaddafi's coup;EASY
What did Gaddafi tell the people that the revolution represented;DIFFICULT
Why did Gaddafi select these men as RCC members;EASY
Where was the military court located that tried the tribal leaders in 1971;EASY
What language was used in official communications by the government of Libya;DIFFICULT
With what country did Libya conclude the Hassi Messaoud defense agreement;DIFFICULT
What philosophy was named for Gamal Abdel Nasser;EASY
Who compared Gaddafi to Hitler;DIFFICULT
Who stated that Gaddafi was fond of children;EASY
What ICC prosector claimed that Gaddafi had ordered soldiers to rape opposition women;EASY
Who stated that Gaddafi was a gifted speaker;EASY
What sort of virus did Gaddafi describe HIV as;DIFFICULT
Who was initially named prime minister by the GNC;EASY
What does Cyprus rank in terms of size in the Mediterranean ;DIFFICULT
What slogan was frequently used in Turkish Cypriot protests;DIFFICULT
Which organization rejected the justification used by Turkey to invade;DIFFICULT
What two mountains ranges are located on the island of Cyprus;EASY
What plain is located in between the Troodos Mountains and the Kyrenia Range;EASY
Where are temperatures more extreme compared to the coast of Cyprus;DIFFICULT
What is the total number of completed dams located on Cyprus;EASY
How much was Turkey ordered to pay in compensation to Cyprus;EASY
What year was Turkey ordered to pay fines to Cyprus;EASY
Who was using Cyprus as a tax haven;DIFFICULT
What religion do most Greek Cypriots identify with;EASY
What religion do most Turkish Cypriots identify with;EASY
What plays a large factor in determining admission at a university;EASY
Name one of the individuals considered the founding fathers of modern Cypriot art;EASY
Name the other individual considered the founding fathers of modern Cypriot art;EASY
Which 2014 novel uses Cyprus as its main location;DIFFICULT
What fruits are commonly used in foods;DIFFICULT
Can you name some common vegetables used in Cyprus;EASY
Can you name some common fruits used in Cyprus;EASY
Can you name some common pulses used in Cyprus;EASY
Which Cypriot tennis player ranked 8th in the world;DIFFICULT
In what year did Spielberg tell a magazine interviewer about earning his Boy Scouts merit badge;DIFFICULT
In what year did Spielberg say he regretted showing the motherships interior in the 1980 version of Close Encounters;DIFFICULT
What movie did the American Film Institute rank as #1 on their 10 Greatest American Films ever Made list in 2007;EASY
How did Irving describe Spielberg's house;DIFFICULT
When was Spielberg named the 'most influential celebrity in America';EASY
Which Spielberg movie showed its main character was a Boy Scout;DIFFICULT
How are the Science Fiction Hall of Fame induction ceremonies usually described as;DIFFICULT
The water pump supplied water pressure to a plunger located where;EASY
What type of wood was used on the inside ;DIFFICULT
The single door is sometimes located where;EASY
What is the chain guided by in a compensation system that uses chains;DIFFICULT
Why do hydraulic elevators use more energy;DIFFICULT
What defines a climbing elevator;EASY
What settings are climbing elevators used in;DIFFICULT
Eventually safety locks were used to guarantee what;DIFFICULT
How are the selected cars then readied for passengers ;EASY
The elevator located at the Casco Viejo station in the Bilbao Metro is also used for what;EASY
Some freight elevators allow transport of both freight and passengers by using what;DIFFICULT
What is an orchestra lift used for;DIFFICULT
What is on the background of the image which can be used as a scale to represent the size of the mechanism;DIFFICULT
What types of elevators occassionaly do not use a traditional elevator shaft machine room or hoistway;DIFFICULT
What are small freight elevators used for things such as food called;DIFFICULT
What rooms are dumbwaiters frequently used in;DIFFICULT
An inclined plane with a conveyor belt describes what type of elevator;DIFFICULT
What industries are these types of elevators generally used in;DIFFICULT
What are spiral screws used for;DIFFICULT
What type of elevators are used for loading loose materials into bulk carriers;DIFFICULT
Modern elevator position or floor indicaters often use what type of bulbs;DIFFICULT
What type of lanterns are used outside elevators as well as inside most cabs;DIFFICULT
Some elevators may use the color convention for only what purpose;DIFFICULT
What Israeli company uses motion sensors to display information on a screen embedded in the wall of the cabs;DIFFICULT
LiftEye uses virtual window technology for what;DIFFICULT
What type of elevators are used in the Taipei 101 office tower;DIFFICULT
How much more dense is Neptune compared to Earth;DIFFICULT
What is Neptune named after;EASY
What Greek god was neptune named for;EASY
Who claimed the right to name Neptune ;EASY
What did the discoverer want to name Neptune first ;EASY
What did Le Verrier want to name Uranus;EASY
Who refused the right to name Neptune;EASY
What was the Biblical sea monster that Neptune is named in Hebrew ;EASY
What was the Biblical land monster that Neptune is named in Hebrew;EASY
What year did the International Astronomical Union define the word planet ;EASY
What year did the International Astronomical Union define the word star;EASY
How much more mass does Neptune have compared to Earth ;DIFFICULT
What does Neptune have more of compared to Uranus ;DIFFICULT
Which three planets have small quadrupole moments compared to Neptune;DIFFICULT
What is the effect called that describes the flow direction on Neptune ;DIFFICULT
What is the effect called that describes the flow direction on Jupiter;DIFFICULT
How much percentage of the sun does Neptune get compared to Uranus;DIFFICULT
The current heat flow on Neptune might be explained by what;DIFFICULT
How much percentage of the sun does Neptune get compared to Jupiter;DIFFICULT
Using the heliocentric coordinate system when did Neptune reach the discovery longitude ;DIFFICULT
Using the heliocentric coordinate system when did Jupiter reach the discovery longitude;DIFFICULT
What is the only object identified with Neptune's trailing L5 Lagrangian point;EASY
The same systems are used for both urban and intercity what;DIFFICULT
What is used to haul passengers cars;DIFFICULT
All regions use the same supply voltages and;DIFFICULT
Why is DC motor being used more than AC type;DIFFICULT
What are two types of railway transportation still use DC motor;DIFFICULT
All early electrified motors used what type of motor;DIFFICULT
What is most common volatage range used by railway system;DIFFICULT
Why 1kV voltage is almost always used by rail systems;DIFFICULT
Which system uses higher voltages;DIFFICULT
What is being used on all bulk power transmission lines;DIFFICULT
What railway line is DC being used in Portugal;DIFFICULT
There is a hog railway located where;EASY
The Cascade Line is located where;EASY
1500 V DC is used in what district in Connecticut;DIFFICULT
The South Shore Line suburb line uses what;DIFFICULT
What voltage is being used in railway system of South Africa and Chile;DIFFICULT
Besides using 3kV DC what other power type is used in the former Soviet Union countries;DIFFICULT
What does the railway system of US use DC or AC;DIFFICULT
What was formally used by the Mississippi Road;DIFFICULT
What is used by the current Soviet Union countries;DIFFICULT
New York transit in the United States uses what;DIFFICULT
The Kukuburra suburban railway is located where;EASY
What type is mostly used third rail or overhead wires;DIFFICULT
Is trird rail system being used exclusively with AC or DC ;DIFFICULT
All electrical systems use what kind of wires;DIFFICULT
Overhead wires are more compact than third rail and can be used for what;DIFFICULT
Can DC systems use low-level platform;DIFFICULT
What area in US discontinued using overhead wires for streetcars in 1962;DIFFICULT
All street trams use conduit what;DIFFICULT
