What are the individual pixels defined by;EASY
The weighted average of the luminance and the noise in the electronic gain is defined as what;EASY
What did they used to call the municipalities within Mexico City;DIFFICULT
What is the minimum height in meters of the region Mexico City is located in;EASY
Where are most of the trees located in Mexico City;EASY
Where is the lake located in Atenco;EASY
Where was the state government located when Mexico City was declared the capital;EASY
Compared to other cities in Latin America how early did Mexico City legalize same sex marriage;DIFFICULT
What used to be the main party district of Mexico City;DIFFICULT
What ranking in terms of GDP is Mexico City globally;DIFFICULT
Compared to other cities in Mexico Mexico City's growth is;DIFFICULT
Chapultepec Castle is located where;EASY
What is the name of the tour bus that shows off the monuments of Mexico City;DIFFICULT
Who is the Museo Soumaya named after;EASY
What type of theaters does Mexico City have the most of compared to other cities;DIFFICULT
What worldwide ranking does UNAM hold;DIFFICULT
What are the markets called that are located and run by the boroughs;EASY
The author uses which adjective to describe the mercados;DIFFICULT
Napoleon was most likely named after what family relation;EASY
What was the name of the general ordered by Napoleon to launch another attack against Austria;EASY
What did Napoleon use to justify his creation of an imperial system;DIFFICULT
How many crowns were used in Napoleon's coronation ceremony;DIFFICULT
Who did Napoleon select to lead the troops sent to invade Portugal;EASY
What methods used by the Russian army made it hard for the French to find food;DIFFICULT
What was the name of the governor who ordered the burning of Moscow;EASY
What substance used in Napoleon's treatment is it suggested prevented his stomach from expelling arsenic compounds;DIFFICULT
In what year was the article describing the type of arsenic found in Napoleon's hair published;DIFFICULT
In what year did Napoleon say that skilled rulers were able to both control and use priests;DIFFICULT
How do historians describe Napoleon in his use of France's financial bureaucratic and diplomatic systems;DIFFICULT
How do historians describe Napoleon's impact on people in one-on-one encounters;DIFFICULT
What abbreviated term did the British often use to refer to Napoleon;DIFFICULT
Which segment of the British press often showed Napoleon as being much shorter than average;DIFFICULT
What height was Napoleon incorrectly listed as at his time of death;EASY
How have many historians described Napoleon's foreign policy ambitions;DIFFICULT
Who compared Napoleon to Hitler in 1947;DIFFICULT
Who compared Napoleon to Hitler in 2005;DIFFICULT
Which historian describes Napoleon's legacy in terms of years spent at war numbers of European dead and France's bankruptcy and loss of colonies;DIFFICULT
Which Roman emperor ordered the conquest of the Germans;EASY
Who ordered the conquest of the Germans in the 1200's BC;EASY
Who first used rex teutonicum;DIFFICULT
What title is first used in the 1100's;DIFFICULT
What term has been used to refer to the people of the region since the 1200's;DIFFICULT
What index ranked Germany high before the 2006 FIFA World Cup;DIFFICULT
In what year was Germany ranked the most valued nation;DIFFICULT
What percentage of 14 year olds in 2009 said they would choose German for their nationality if they got to choose;DIFFICULT
Which country has stated that it might join ASEAN;EASY
Name an Indonesian Islamic scholar who lived from 1908-1981;EASY
Name the largest country in Southeast Asia;EASY
Name the line that splits the Indonesian Archipelago;EASY
Name the largest species of fish in the world;EASY
Name some important commodities that originated in Southeast asian region;EASY
name the largest ethnic group in Southeast Asia;EASY
Name the most Muslim populous region in Asia;EASY
Singapore & Vietnam shows which influence predominantly;DIFFICULT
What other forms of writing materials were used during this period;DIFFICULT
Who only used words that ended in consenants;DIFFICULT
How does the cost of attending BYU compare to the cost of attending similar universities;DIFFICULT
Who opposed the named "Brigham Young College";EASY
How did Joseph F Maeser solve the theory of evolution crisis;DIFFICULT
What is BYU ranked 88th in;DIFFICULT
Who ranked BYU as the best college in Utah;DIFFICULT
Who ranked BYU the vest value for college in 2007;DIFFICULT
Where did BYU rank in 2013 in the US News & World Report rankings;DIFFICULT
Where did BYU rank in 2016 in the Quarterly Journal of Economics study;DIFFICULT
Where did Princeton Review rank BYU in 2004 for best value for college;DIFFICULT
Where was BYU ranked in 2014 for number of students who go on to earn PhDs;DIFFICULT
Where was BYU ranked in 2014 for students who go on to dental school;DIFFICULT
Who ranked BYU's Marriott School of Mangement as No 5 for it's undergrad programs in 2009;DIFFICULT
Who ranked BYU's MBA program No 1 among regional schools in 2007;DIFFICULT
Using 2010 data how was BYU ranked as a university creating the most startup companies through campus research;DIFFICULT
Who ranked BYU as No 11 of institutions whose grads were top-rated by recruiters in a 2010 article;DIFFICULT
Who ranked the school's MAcc program No 8 and No 3 respectively;DIFFICULT
What rankings for 2010 did the School of Accountancy receive;DIFFICULT
How did the Institute of International Education rank BYU in 2009 compared with US universities that offer study abroad opportunities;DIFFICULT
Who ranked BYU number one in study abroad opportunities in 2000;DIFFICULT
The new Statement on Academic Freedom allows students to analyze and discuss Church doctrine but does not allow student expressions that do what;DIFFICULT
What building is named after Earl and Kathryn Pardoe;EASY
What building was named after prominent Utah theater figure Philip N Margetts;EASY
Who was the Nelke Theatre named for;EASY
What type of theater is Nelke Theatre primarily used for;DIFFICULT
What is named after T Earl and Gerrit de Jong Jr;EASY
What theater was named for Kathryn N Margetts;EASY
What is named after Kathryn de Jong Jr;EASY
What did Karl G Maeser tell Brigham Young;DIFFICULT
How many BYU campus rooms are used for the purposes of LDS Church congregations;DIFFICULT
What are 150 rooms on campus used for;DIFFICULT
How was BYU ranked by The Princeton Review for having the happiest students and highest quality of life in 2008;DIFFICULT
What group of people were suddenly free to go shopping without fears of being judged or reprimanded ;DIFFICULT
What group of people were suddenly no longer free to go shopping with fears of being judged or reprimanded ;DIFFICULT
What book described the functionality and operation of a contemporary Paris department/novelty store;DIFFICULT
What sort of stores were The Grands Magasins Dufayel compared to ;DIFFICULT
What sort of stores were The Grands Magasins Dufayel not compared to ;DIFFICULT
When was electric lighting first installed and used in the store ;DIFFICULT
When was electric lighting last installed and used in the store ;DIFFICULT
What department store in Puerto Rico is named after an American city;EASY
What famous author described parts of the mall in his books;DIFFICULT
What unknown author described parts of the mall in his books;DIFFICULT
What movie demonstrates the operation of department stores in the former Soviet Union;DIFFICULT
What movie demonstrates the operation of department stores in the current Soviet Union;DIFFICULT
Who located in Paris after merging in 1893;EASY
Jewish law includes which principle used to justify copyright;DIFFICULT
What Jewish principle justified copyright in 500 BCE;DIFFICULT
What excludes the inventor from making using selling or offering to sell an invention;DIFFICULT
What has the stated objective of protecting the inventor;EASY
What is caused by using or selling a patented invention without permission;DIFFICULT
Where does the safe harbor to use a patented invention for research generally not exist;DIFFICULT
What is caused by using or selling a patented invention;DIFFICULT
What occurs when someone uses a trademark that is identical or confusingly similar to a trademark owned by someone else;DIFFICULT
What occurs when someone uses an identical trademark but not when the use a similar trademark;DIFFICULT
What law do most US states use to protect trade secrets;DIFFICULT
What do most US states use the Economic Espionage Act to protect;DIFFICULT
What does federal law protect using the Uniform Trade Secrets Act;DIFFICULT
Who pointed out that "if copyright were a natural right nothing could justify terminating this right after a certain period of time";DIFFICULT
What is an example of a civil law to prevent circumvention of software used to enforce digital rights;DIFFICULT
What is any sign which is capable of distinguishing one business's product from another business's;EASY
What states border Florida ;EASY
Where does Florida rank in US population ;DIFFICULT
What state is located in the Northeastern region of the US;EASY
Name a National Park in Florida ;EASY
What was the name of the river named after a sheep;EASY
What legal system is still used by florida ;DIFFICULT
What legal system has never been used by Florida;DIFFICULT
Where did florida rank in population growth ;DIFFICULT
Why do people choose not to identify as American ancestry;DIFFICULT
What do many white long term floridian families identify with ;EASY
What was Florida named in 2011;EASY
Where did housing spending ranking nationally ;DIFFICULT
Name another race in florida ;EASY
Which singer used Trident studios in addition to Queen and the Beatles;DIFFICULT
Which Queen song ranked as the 31st greatest guitar song in a 1998 Rolling Stone article;DIFFICULT
What medium helped Queen fans get used to their songs before Live Aid;DIFFICULT
Paul Rodgers used to be the lead singer of what two bands;DIFFICULT
What band named after a floating vehicle influenced Queen;EASY
This band named after an animal was inspired by Queen;EASY
A 2005 poll stated that which band's performance at Live Aid was the best ever;EASY
Where did Queen rank on Rolling Stone's 100 Greatest Artists of All Time in 2001;DIFFICULT
In 2010 VH1 ranked Queen at what number on their Greatest Artist of All Time List;DIFFICULT
What term described the method used to regulate common practice and or order;DIFFICULT
What other name is used when referring to the origins of the Presbyterian Church;DIFFICULT
Which book to Muslims use to regulate common practice and order;DIFFICULT
How do Presbyterians show their theological writings;DIFFICULT
Presbyterians had to distinguished between "Church" and "Meeting house" What was "Church" referring too;EASY
What is located on a different level than the congregation in a Presbyterian church;EASY
In a Presbyterian church there may be a rail located between the choir and what;EASY
What is the congregation that is located in the heart of Swallow Street called;EASY
What is the name of the first three listed reformed Presbyterian Church's in the United States;EASY
What are some of the large dams located in Thuringia;EASY
Which tributary is located on the southern border ;EASY
What are some of the broken dams located in Thuringia;EASY
Which tributary is located on the northern border;EASY
How many municipalities in Thuringia are classified as towns;EASY
How many municipalities in Thuringia are classified as hostile;EASY
What is something no longer important to Thuringia compared to most areas of Germany;DIFFICULT
How do wages in Thuringia compare to their neighbors;DIFFICULT
For how long have Thuringian children been using the current education system;DIFFICULT
What must a species do in order to be classified as a predator;EASY
How would you describe a predator that primarily eats plants;DIFFICULT
A species that uses a host body to survive and reproduce is classified as a what;DIFFICULT
How would you describe a diet of a species that eats primarily dead organic material ;DIFFICULT
The study in which ecologists examine the way predators interact with their prey is called what;DIFFICULT
Who is involved in classifying different types of prey;EASY
What method is used to keep track of how prey tries to escape their predator;DIFFICULT
How many factors are used when studying how prey avoids their predator;DIFFICULT
Name an exemplar of an predator that uses digestion to kill and gain nutrients from it's prey;EASY
To be classified as a predator what action must be performed;EASY
Predator and prey relationships that improve fitness for both species are classified as this type of relationship;EASY
How many forms are used to classify a single plant;DIFFICULT
What term is used for predators and prey being well suited to hunt and evade each other;DIFFICULT
What term describes how predators occasionally switch to a scavenging or herbivorous diet;DIFFICULT
Why are species can be difficult to classify because they;EASY
What are organisms called that show carnivory and herbivory;DIFFICULT
What can make classification of predators problematic when using a food pyramid;DIFFICULT
Why would carnivourous plants be difficult to classify into a food pyramid;EASY
Would it be easy or difficult to classify organims that eat parasites in a food pyramid;EASY
Who described predation by describing competing genes within the predator;DIFFICULT
What term is used to decribe predators that prey on their own competition;DIFFICULT
Which version of evolutionary theory is easiest to use when explaining predation as competition;DIFFICULT
What term is used to describe how prey evades a predator;DIFFICULT
What term is used for an adaptation that enables species to blend into the background;DIFFICULT
Ogranisms use camoflauge to blend with their habitat and what else;DIFFICULT
What else can be used to describe dead leaves besides their color;DIFFICULT
How can predators use mimicry;DIFFICULT
Why does a female firefly use the markings on its wings;DIFFICULT
What theory describes how prey fish take advantage of a predator;DIFFICULT
What are some species that use social predation to prey on animals much larger than themselves;DIFFICULT
Captive animals can distinguish co-inhabitats from what other group;EASY
The electric eel uses electric shock for defense and what other purpose;DIFFICULT
What method is used by giant otters to prevent their prey from attacking them;DIFFICULT
What scientific term is used to describe  organisms that are brightly colored as a warning to predators;DIFFICULT
What do predators use to warn their prey;DIFFICULT
What group benefits from using camoflage if an organism is killed using it;DIFFICULT
How does a predator see a species using camflage as;DIFFICULT
For how long have humans been using stone tools and weapons;DIFFICULT
In what areas do bears have an advantage compared to big cats;DIFFICULT
What is one thing bears use to find their prey;DIFFICULT
Which principle states that if two species ecologicl niches/ overlap both species are likely to be in competition with one another;EASY
What principle states that when two prey species have small populations they will compete with each other;EASY
Predators are used in conservation to reduce what type of species from the environment;DIFFICULT
What is one thing that can happen if you use pesticides;DIFFICULT
In what area are agricultural pests used for research;DIFFICULT
What chemical agent is used to control introduced species;DIFFICULT
What superhero team used secret identities;DIFFICULT
Choosing to follow comic book tradition and tropes was called what;DIFFICULT
Writer Geoff Boucher compared DC to what dull 1960s crooner;DIFFICULT
Who compared DC comics to the Beatles;DIFFICULT
Which DC superhero was listed in Esquire's top 28 college campus heroes;EASY
Which author was the first to use the term "British Empire";DIFFICULT
What had the Dutch East India Company initially named Australia;EASY
When Britain had to choose between its Japanese alliance or the US which did it choose;DIFFICULT
When was the right of Dominions to determine their own foreign policy recognized;EASY
Which territory had been compared to Gibraltar;DIFFICULT
Which territory did Margaret Thatcher compare Hong Kong to;DIFFICULT
What is the term for keys used for identification;DIFFICULT
What book is still used for nomenclature;DIFFICULT
What led scientists to believe that plants should be classified according to something other than just sexual system;EASY
What can auxin plant hormones also be used as;DIFFICULT
What does phylogenetics use to determine plant categories;DIFFICULT
What did the Angiosperm Phylogeny group use determine a phylogeny of flowering plants;EASY
What is used to rebuild cells;DIFFICULT
What is used instead of glucose in sunflowers;DIFFICULT
What polymer is used to strengthen cell walls;DIFFICULT
Plant oil is used for what kind of fuel;DIFFICULT
How can climate changes be determined from soil;EASY
What atmospheric gas can be determined from fossilized leaf sizes and shapes;EASY
What plant did Mendel use to demonstrate inheritance;DIFFICULT
What other plant was used in the discovery of different genes;DIFFICULT
What simple plant has been used to study plant cells;DIFFICULT
What common plant has been used for studying the production of sugar;DIFFICULT
How can scientists use bacteria in the study of plants;DIFFICULT
What is this kind of introduction and transfer used for;DIFFICULT
Who developed the procedures used in this transfer;DIFFICULT
What does the plant use for internal processes;DIFFICULT
How do animals use plants;DIFFICULT
To what did Darwin compare the top of the plant radical;DIFFICULT
What are roots used for in beets and carrots;DIFFICULT
What are the stems used for in cacti;DIFFICULT
How are grouping determined currently;EASY
Who maintains a standard of grouping for naming purposes;EASY
What traits show a shared ancestry;DIFFICULT
What is used now to group plants;DIFFICULT
What was previously used to group plants;DIFFICULT
When was DNA sequencing first used for grouping plants;DIFFICULT
Name a film role that Madonna acted in;EASY
Name one of Madonna's other business ventures;EASY
Who did Madonna tell in an interview that as a young girl she was lonely and always searching for something;DIFFICULT
Name one child from the union of Tony and Joan;EASY
Name a soundtrack in the film Who's That Girl;EASY
When was Madonna named "Artist of the Decade" by MTV Billboard and Musician Magazine;EASY
Justify My Love reached which number in the US charts;DIFFICULT
What was the name of the erotic thriller that shows scenes of sadomasochism and bondage;DIFFICULT
Which biographer described her song "I'll Remember" as trying to clean up Madonna's image;DIFFICULT
Who listed Ray of Light as "The 500 Greatest Albums of All Time";EASY
Which edition of the Guinness Book of World Record states that no female artist sold more records than Madonna;EASY
Warner filed a countersuit stating that who lost 10 of millions of dollars on its own;EASY
Who stated that he could not support the adoption since he was alive;EASY
Madonna granted which TV show the rights to her entire catalog of music;DIFFICULT
Who named Madonna as the top-earning celebrity of the year;EASY
Which company was selected to release the film;EASY
Which magazine stated that Madonna was the greatest songwriter of all time;EASY
Who stated that Madonna's voice are key to her rock roots;EASY
Name one of Madonna's major influence;EASY
In which video does it show Madonna being scolded by her boss in Italian;DIFFICULT
Name one actor that Madonna was inspired by;EASY
Who stated that Madonna was a bad actress to watch;EASY
Madonna used which TV company to help with her career;DIFFICULT
Who named Madonna the Greatest Music Video star ever;EASY
What did Madonna use in her concerts;DIFFICULT
Madonna used what to benefit her career;DIFFICULT
Who named Madonna as the top female touring artist of all time;EASY
What is defined as the official codification of federal statutory law;EASY
Federal sovereign only possess authority if it is stated in what;EASY
Can states grant rights to citizens that are not defined by the constitution;EASY
What decisis states that no lower court will enforce an unconstitutional statute;EASY
What allows American tort law to be summarized easily;DIFFICULT
What is a law enacted by Congress that states that it refuses to regulate some industries as long as the states have regulations in place already;EASY
The Chevron deference prevents regulations from interpreting what;DIFFICULT
What is used to determine whether federal judicial power extends to formulating binding precedent;DIFFICULT
What states that there is no general federal common law;EASY
When are states allowed to use plenary power;DIFFICULT
What states that deference is one way only;EASY
What does it mean when Erie states that deference is one way only;EASY
What doctrine states that state courts are bound by federal interpretations;EASY
The Erie doctrine states that federal courts can do what;EASY
Which ranch applies interprets and occasionally overturns both state statutes and regulations;EASY
What do convicts use the Miranda warning for;DIFFICULT
California refuses to use codified statutes instead of what;DIFFICULT
What were the names of some of the early cultures located in Myanmar;EASY
How is Burma officially identified in the United States ;EASY
Are international monitors used in the elections of Burma ;DIFFICULT
How much rain is received in the region where Burma is located ;EASY
What were some of the opinions foreign advisers stated about the Burma 2010 elections ;EASY
How are children used in the conflicts in Burma;DIFFICULT
Who did the British choose to back in Burma during WWII ;DIFFICULT
Who was the videotape used as evidence against in Burma ;DIFFICULT
Name two of the metropolitan areas that are enjoyed most frequently by tourist in Myanmar  ;EASY
How many people in Burma are currently using a work visa for Thailand;DIFFICULT
What are the four categories for the most prolific dialects used in Burma ;DIFFICULT
What are the primary languages of Europe that are used in Burma ;DIFFICULT
Are the languages of Myanmar widely used by other nations  ;DIFFICULT
Are children required to go to school or can they choose to stay at home and work ;DIFFICULT
What are popular ways that fish are used in Burma ;DIFFICULT
Where any of the Burmese films ever used as an instrument to influence the people ;DIFFICULT
What is another word to describe a Jew;DIFFICULT
What is a Russian word used to describe a Jew;DIFFICULT
Name one person that Jewish ancestry traced back to;EASY
Genetic studies show that Jews bear their strongest resemblance to the peoples of where;DIFFICULT
What people do Jews show the least genetic resemblance to;DIFFICULT
What is used as a warning against intermarriage between Jews and Canaanites;DIFFICULT
Who believed the status of the offspring of mixed marriages was determined patrilineally in the Bible;EASY
Who believed that the status of offspring of mixed marriages was determined matrilineally in the Bible;EASY
Name one thing that has accounted for Jewish population growth;EASY
Name one reason historians believe the conversion during the Roman era was limited in number and did not account for much of the Jewish population growth;EASY
Name one way Jewish cultural expressions differ in each community;EASY
Name another way Jewish cultural expressions differ in each community;EASY
Name one major group that Jews are often identified as belonging to;EASY
Name another major group that Jews are often identified as belonging to;EASY
What language did the Jews of Israel not use at that time;DIFFICULT
Name one reason the ancient and distinct Jewish languages have largely fallen out of use;EASY
North Africans continue to use what language as their mother tongue;DIFFICULT
Mizrahi Jews show evidence of admixture with whom;DIFFICULT
What does not show shared Middle Eastern ancestry;DIFFICULT
Name a Jewish community that disappeared entirely;EASY
What was the disability described by Bernard Lewis as "most degrading";DIFFICULT
What was one method used to entirely eliminate Jewish populations;DIFFICULT
What methods were never used on Jewish populations;DIFFICULT
What is one method used to prevent intermarriage;DIFFICULT
During what time did cotton become widely used in India;DIFFICULT
During what time did copper beads become widely used in India;DIFFICULT
What 1350 writer stated that cotton was produced by sheep that grew on trees;EASY
What 1350 writer stated that wool was produced by sheep that grew on trees;EASY
What business development did the Americans use to establish a hold on the global cotton market;DIFFICULT
What bacterium is used to produced GM cotton;DIFFICULT
What bacterium is used to produce larvae cotton;DIFFICULT
What group in the US determines the allowed practices in organic agriculture;EASY
What group in the US determines the allowed practices in 24 countries;EASY
For what is cotton used to make;DIFFICULT
For what are jeans used to make;DIFFICULT
For what is cottonseed used after it is separate from the fibers;DIFFICULT
What is cottonseed meal used for feed;DIFFICULT
For what purpose are cottonseed hulls used in feed;DIFFICULT
As what did early scientists describe gossypol ;DIFFICULT
For what is cottonseed used after it is separate from root bark;DIFFICULT
For what purpose is root bark used in feed;DIFFICULT
As what did early scientists describe cottonseed oil;DIFFICULT
What part of the cotton plant is used for paper manufacture;DIFFICULT
What individual first used cotton wool medically;DIFFICULT
What part of wool is used for paper manufacture;DIFFICULT
What individual first used wool medically;DIFFICULT
What organization has Brazil tried to use to curb US cotton subsidies;DIFFICULT
What organization has the US tried to use to curb Brazilian subsidies;DIFFICULT
